{
  "schemaVersion": "1.0",
  "kind": "process-telemetry",
  "generatedAt": "2026-03-21T00:00:00.000Z",
  "records": [
    {
      "id": "proc-docs-lean-1",
      "recordedAt": "2026-03-20T01:00:00.000Z",
      "task_family": "docs_only",
      "task_profile_id": "profile.docs.lean",
      "route_id": "route.docs.lean.v1",
      "task_duration_ms": 120,
      "files_touched": ["docs/README.md"],
      "validators_run": ["pnpm playbook docs audit --json"],
      "rule_packs_selected": ["docs-governance"],
      "required_validations_selected": ["pnpm playbook docs audit --json"],
      "optional_validations_selected": [],
      "validation_duration_ms": 40,
      "planning_duration_ms": 25,
      "apply_duration_ms": 50,
      "retry_count": 0,
      "merge_conflict_risk": 0.02,
      "actual_merge_conflict": false,
      "first_pass_success": true,
      "human_intervention_required": false,
      "parallel_lane_count": 1,
      "over_validation_signal": false,
      "under_validation_signal": false,
      "prompt_size": 120,
      "reasoning_scope": "narrow"
    },
    {
      "id": "proc-contracts-heavy-1",
      "recordedAt": "2026-03-20T02:00:00.000Z",
      "task_family": "contracts_schema",
      "task_profile_id": "profile.contracts.strict",
      "route_id": "route.contracts.strict.v1",
      "task_duration_ms": 1600,
      "files_touched": ["packages/contracts/src/process-telemetry.schema.json"],
      "validators_run": ["pnpm -r build", "pnpm test", "pnpm playbook contracts --json"],
      "rule_packs_selected": ["contracts", "schema", "governance"],
      "required_validations_selected": ["pnpm -r build", "pnpm test", "pnpm playbook contracts --json"],
      "optional_validations_selected": ["pnpm playbook docs audit --json"],
      "validation_duration_ms": 900,
      "planning_duration_ms": 170,
      "apply_duration_ms": 450,
      "retry_count": 2,
      "merge_conflict_risk": 0.26,
      "actual_merge_conflict": false,
      "first_pass_success": false,
      "human_intervention_required": false,
      "parallel_lane_count": 2,
      "over_validation_signal": false,
      "under_validation_signal": false,
      "prompt_size": 520,
      "reasoning_scope": "repository"
    },
    {
      "id": "proc-engine-overval-1",
      "recordedAt": "2026-03-20T03:00:00.000Z",
      "task_family": "engine_scoring",
      "task_profile_id": "profile.engine.safe",
      "route_id": "route.engine.score.v2",
      "task_duration_ms": 1900,
      "files_touched": ["packages/engine/src/telemetry/outcomeTelemetry.ts"],
      "validators_run": ["pnpm -r build", "pnpm test", "pnpm playbook telemetry summary --json", "pnpm playbook telemetry process --json"],
      "rule_packs_selected": ["engine", "telemetry"],
      "required_validations_selected": ["pnpm -r build", "pnpm test"],
      "optional_validations_selected": ["pnpm playbook telemetry summary --json", "pnpm playbook telemetry process --json"],
      "validation_duration_ms": 1100,
      "planning_duration_ms": 190,
      "apply_duration_ms": 530,
      "retry_count": 0,
      "merge_conflict_risk": 0.18,
      "actual_merge_conflict": false,
      "first_pass_success": true,
      "human_intervention_required": false,
      "parallel_lane_count": 3,
      "over_validation_signal": true,
      "under_validation_signal": false,
      "prompt_size": 610,
      "reasoning_scope": "module"
    },
    {
      "id": "proc-pattern-cross-repo-1",
      "recordedAt": "2026-03-20T04:00:00.000Z",
      "task_family": "pattern_learning",
      "task_profile_id": "profile.pattern.cross-repo",
      "route_id": "route.pattern.cross-repo.v1",
      "task_duration_ms": 2400,
      "files_touched": ["packages/engine/src/learn/draft.ts", "docs/contracts/LEARNING_STATE.md"],
      "validators_run": ["pnpm -r build", "pnpm test", "pnpm playbook docs audit --json"],
      "rule_packs_selected": ["learning", "knowledge", "governance"],
      "required_validations_selected": ["pnpm -r build", "pnpm test"],
      "optional_validations_selected": ["pnpm playbook docs audit --json"],
      "validation_duration_ms": 800,
      "planning_duration_ms": 280,
      "apply_duration_ms": 1200,
      "retry_count": 2,
      "merge_conflict_risk": 0.52,
      "actual_merge_conflict": true,
      "first_pass_success": false,
      "human_intervention_required": true,
      "parallel_lane_count": 1,
      "over_validation_signal": false,
      "under_validation_signal": false,
      "prompt_size": 880,
      "reasoning_scope": "cross-repo"
    },
    {
      "id": "proc-partial-safe-degrade-1",
      "recordedAt": "2026-03-20T05:00:00.000Z",
      "task_family": "docs_only",
      "task_duration_ms": 95,
      "files_touched": ["docs/CHANGELOG.md"],
      "validators_run": ["pnpm playbook docs audit --json"],
      "retry_count": 0,
      "merge_conflict_risk": 0,
      "first_pass_success": true,
      "prompt_size": 90,
      "reasoning_scope": "narrow"
    }
  ],
  "summary": {
    "total_records": 5,
    "total_task_duration_ms": 6115,
    "average_task_duration_ms": 1223,
    "total_retry_count": 4,
    "first_pass_success_count": 3,
    "average_merge_conflict_risk": 0.196,
    "total_files_touched_unique": 6,
    "total_validators_run_unique": 6,
    "task_family_counts": {
      "contracts_schema": 1,
      "docs_only": 2,
      "engine_scoring": 1,
      "pattern_learning": 1
    },
    "validators_run_counts": {
      "pnpm -r build": 3,
      "pnpm playbook contracts --json": 1,
      "pnpm playbook docs audit --json": 3,
      "pnpm playbook telemetry process --json": 1,
      "pnpm playbook telemetry summary --json": 1,
      "pnpm test": 3
    },
    "reasoning_scope_counts": {
      "narrow": 2,
      "module": 1,
      "repository": 1,
      "cross-repo": 1
    },
    "route_id_counts": {
      "route.contracts.strict.v1": 1,
      "route.docs.lean.v1": 1,
      "route.engine.score.v2": 1,
      "route.pattern.cross-repo.v1": 1
    },
    "task_profile_id_counts": {
      "profile.contracts.strict": 1,
      "profile.docs.lean": 1,
      "profile.engine.safe": 1,
      "profile.pattern.cross-repo": 1
    },
    "rule_packs_selected_counts": {
      "contracts": 1,
      "engine": 1,
      "governance": 2,
      "knowledge": 1,
      "learning": 1,
      "schema": 1,
      "telemetry": 1,
      "docs-governance": 1
    },
    "required_validations_selected_counts": {
      "pnpm -r build": 3,
      "pnpm playbook contracts --json": 1,
      "pnpm playbook docs audit --json": 1,
      "pnpm test": 3
    },
    "optional_validations_selected_counts": {
      "pnpm playbook docs audit --json": 2,
      "pnpm playbook telemetry process --json": 1,
      "pnpm playbook telemetry summary --json": 1
    },
    "total_validation_duration_ms": 2840,
    "total_planning_duration_ms": 665,
    "total_apply_duration_ms": 2230,
    "human_intervention_required_count": 1,
    "actual_merge_conflict_count": 1,
    "average_parallel_lane_count": 1.6,
    "over_validation_signal_count": 1,
    "under_validation_signal_count": 0
  }
}
